{
  "authority_class": "process-attested-fresh-merge",
  "base_ref": "main",
  "candidate": {
    "base_sha": "2222222222222222222222222222222222222222",
    "head_sha": "0000000000000000000000000000000000000000",
    "merge_group_sha": null,
    "policy_sha": "3333333333333333333333333333333333333333",
    "ruleset_fingerprint": "sha256:aaaaaaaaaaaaaaaaaaaaaaaaaaaaaaaaaaaaaaaaaaaaaaaaaaaaaaaaaaaaaaaa",
    "tree_sha": "1111111111111111111111111111111111111111",
    "verification_environment_digest": "sha256:bbbbbbbbbbbbbbbbbbbbbbbbbbbbbbbbbbbbbbbbbbbbbbbbbbbbbbbbbbbbbbbb"
  },
  "candidate_head": "0000000000000000000000000000000000000000",
  "candidate_tree": "1111111111111111111111111111111111111111",
  "g1_g8": "pass",
  "gate_id": "merge-gate-1",
  "issued_at": "2026-08-08T00:00:00Z",
  "maximum_action": "merge",
  "mission_id": "delivery-example",
  "open_findings": 0,
  "open_review_threads": 0,
  "policy_digest": "sha256:0000000000000000000000000000000000000000000000000000000000000000",
  "required_actions": 0,
  "rollout_milestone": "K4.1",
  "safety_interrupt_open": false,
  "schema_version": 1,
  "taste_interrupt_open": false
}
